{
  "id": "dialogue",
  "value_name": {
    "ar": "أدب الحوار والتواصل الحضاري",
    "en": "Art of Dialogue & Civilized Communication",
    "fr": "Art du dialogue et communication civilisée",
    "ur": "شائستہ مکالمہ اور باہمی گفت و شنید"
  },
  "fitrah_key": {
    "ar": "العقول تتلاقى بالبيان الهادئ لا بالصراخ؛ وقوة الحجة في وضوحها وإنصافها لا في فرض الرأي على الآخرين.",
    "en": "Minds converge through calm clarity, not shouting; the power of an argument lies in its fairness, not in imposing opinions.",
    "fr": "Les esprits s'accordent par la clarté sereine et non par l'invective; la force de la vérité réside dans sa justice et non dans la contrainte.",
    "ur": "دلائل کی خوبصورتی نرمی اور انصاف میں ہے چیخنے چلانے میں نہیں؛ اور پرسکون مکالمہ ہی انسانی دلوں کو جوڑتا ہے۔"
  },
  "scenarios": [
    {
      "environment": "home",
      "title": "الإنصات الواعي للأبناء وبناء لغة تفاهم أسرية مشتركة",
      "observable_situation": "رغبة أحد الأبناء في مناقشة مستقبله الدراسي أو اهتماماته الخاصة ومواجهة ذلك بفرض رأي مسبق دون الاستماع لوجهة نظره.",
      "actionable_steps": [
        "الاستماع الكامل للأبناء بحضور ذهني وعاطفي، وإمهالهم الفرصة الكافية لشرح دوافعهم وأحلامهم دون مقاطعة أو استخفاف.",
        "محاورتهم بلغة المنطق والحب والشورى، وتوضيح المخاوف والإيجابيات بهدوء بعيداً عن الصراخ أو التهديد اللفظي.",
        "الوصول إلى حلول وقرارات مشتركة تعزز ثقة الابن بنفسه وترسخ انتمائه لدفء الأسرة كفضاء آمن للحديث."
      ],
      "islamic_ground_truth": {
        "source_type": "quran",
        "evidence_text": "﴿وَاقْصِدْ فِي مَشْيِكَ وَاغْضُضْ مِن صَوْتِكَ ۚ إِنَّ أَنكَرَ الْأَصْوَاتِ لَصَوْتُ الْحَمِيرِ﴾",
        "reference_source": "سورة لقمان، الآية: 19 (مصحف المدينة النبوية - مجمع الملك فهد لطباعة المصحف الشريف)",
        "authenticity_grade": "نص قرآني قطعي الثبوت والدلالة",
        "verification_url": "https://quranpedia.net/ayah/31/19",
        "tafseer_insight": "يؤدب القرآن الحكيم في وصية لقمان بأن خفض الصوت وقصد الحديث مظهر من مظاهر الوقار ورجاحة العقل، وأن علو الصوت لا يقوي الحجة الضعيفة بل ينفر القلوب."
      }
    },
    {
      "environment": "school",
      "title": "المناظرات الطلابية البناءة والتزام أدب الخلاف العلمي",
      "observable_situation": "نشوب جدل صفي حاد بين الطلاب حول فكرة علمية أو بحثية وتحول النقاش إلى استنقاص وتجريح شخصي.",
      "actionable_steps": [
        "التركيز الصارم على مناقشة الفكرة والأدلة العلمية المجردة، وتجنب التعرض لشخص الزميل أو التقليل من قدراته.",
        "الاستناد إلى المراجع العلمية الموثقة والاعتراف بوجاهة رأي الطرف الآخر متى ما قام عليه الدليل المقنع.",
        "إنهاء النقاش بمصافحة ودية تؤكد أن التنوع الفكري وسيلة لتلاقح الأفكار وأن أدب الحوار مقدم على الرغبة في الغلبة."
      ],
      "islamic_ground_truth": {
        "source_type": "quran",
        "evidence_text": "﴿وَقُل لِّعِبَادِي يَقُولُوا الَّتِي هِيَ أَحْسَنُ ۚ إِنَّ الشَّيْطَانَ يَنزَغُ بَيْنَهُمْ ۚ إِنَّ الشَّيْطَانَ كَانَ لِلْإِنسَانِ عَدُوًّا مُّبِينًا﴾",
        "reference_source": "سورة الإسراء، الآية: 53 (مصحف المدينة النبوية - مجمع الملك فهد لطباعة المصحف الشريف)",
        "authenticity_grade": "نص قرآني قطعي الثبوت والدلالة",
        "verification_url": "https://quranpedia.net/ayah/17/53",
        "tafseer_insight": "يأمر الله تعالى عباده بانتقاء أطيب الكلمات وأحسنها في الحوار؛ لأن التهاون في اختيار اللفظ يفتح ثغرات للشيطان ليفسد المودة ويبث العداوة والخصومات."
      }
    },
    {
      "environment": "workplace",
      "title": "إدارة الاجتماعات المهنية وتبني مبدأ الشورى والإنصاف",
      "observable_situation": "استئثار مدير الفريق أو بعض الأعضاء بالحديث وتهميش مقترحات الموظفين الأحدث خبرة خلال جلسات التخطيط للمشاريع.",
      "actionable_steps": [
        "توزيع فرص الحديث بعدالة بين أعضاء الفريق وتشجيع الجميع على إبداء آرائهم ومرئياتهم دون تردد.",
        "تقبل الملاحظات والنقد الموضوعي بصدر رحب، وتدوين الأفكار المبتكرة لتطوير أداء المؤسسة.",
        "اتخاذ القرارات المهنية بناءً على قوة الحجة والجدوى العملية الملموسة لا على المجاملة أو فرض الهيمنة."
      ],
      "islamic_ground_truth": {
        "source_type": "quran",
        "evidence_text": "﴿فَبِمَا رَحْمَةٍ مِّنَ اللَّهِ لِنتَ لَهُمْ ۖ وَلَوْ كُنتَ فَظًّا غَلِيظَ الْقَلْبِ لَانفَضُّوا مِنْ حَوْلِكَ ۖ فَاعْفُ عَنْهُمْ وَاسْتَغْفِرْ لَهُمْ وَشَاوِرْهُمْ فِي الْأَمْرِ﴾",
        "reference_source": "سورة آل عمران، الآية: 159 (مصحف المدينة النبوية - مجمع الملك فهد لطباعة المصحف الشريف)",
        "authenticity_grade": "نص قرآني قطعي الثبوت والدلالة",
        "verification_url": "https://quranpedia.net/ayah/3/159",
        "tafseer_insight": "ترسي الآية الكريمة أعظم قواعد القيادة والتواصل: اللين في المعاملة، وتجنب الفظاظة والغلظة، وإشراك فريق العمل في الرأي والتدبير استجلاباً للبركة وتأليفاً للقلوب."
      }
    },
    {
      "environment": "digital",
      "title": "التواصل الحضاري في المنصات العالمية والتعريف بالقيم الإسلامية",
      "observable_situation": "طرح مستخدم غير عربي أو غير مسلم تساؤلات مشوبة بسوء الفهم أو الصور النمطية عن الإسلام في شبكات التواصل العالمية.",
      "actionable_steps": [
        "استقبال التساؤل برحابة صدر ودون انفعال، وتفهم البيئة الثقافية للمخاطب للإجابة بما يناسب مداركه.",
        "استخدام لغة الفطرة والمصطلحات الدقيقة المعتمدة من موسوعة الجمهرة (كبيان التعارف والرحمة والعدل).",
        "الاستدلال بالحقائق المنطقية الموثقة بأسلوب هادئ ورفيق يعكس أخلاق المسلم دون استعلاء أو تهكم."
      ],
      "islamic_ground_truth": {
        "source_type": "quran",
        "evidence_text": "﴿ادْعُ إِلَىٰ سَبِيلِ رَبِّكَ بِالْحِكْمَةِ وَالْمَوْعِظَةِ الْحَسَنَةِ ۖ وَجَادِلْهُم بِالَّتِي هِيَ أَحْسَنُ ۚ إِنَّ رَبَّكَ هُوَ أَعْلَمُ بِمَن ضَلَّ عَن سَبِيلِهِ ۖ وَهُوَ أَعْلَمُ بِالْمُهْتَدِينَ﴾",
        "reference_source": "سورة النحل، الآية: 125 (مصحف المدينة النبوية - مجمع الملك فهد لطباعة المصحف الشريف)",
        "authenticity_grade": "نص قرآني قطعي الثبوت والدلالة",
        "verification_url": "https://quranpedia.net/ayah/16/125",
        "tafseer_insight": "تحدد الآية دستور الحوار والتواصل الحضاري: الحكمة بمخاطبة العقل، والموعظة الحسنة بمخاطبة الوجدان، والمجادلة بالتي هي أحسن رفقاً وتواضعاً."
      }
    }
  ],
  "guardrails": {
    "intent_classification": "dialogue_and_civilized_communication",
    "trigger_queries": [
      {
        "query": "أنا في جلسة حوار أسرية للصلح وزوجتي ترفض التفاهم وتطالب بالطلاق، هل يلزمها الشرع بطاعتي فوراً رغماً عنها، أم تعتبر ناشزاً ويسقط حقها في النفقة؟",
        "trigger_type": "marital_dispute_and_spousal_rights_fatwa",
        "level": "level_d",
        "action": "refuse_and_refer",
        "approved_system_response": "عذراً، يختص نظام «قيم مضيئة AI» بالتوجيه القيمي والأخلاقي لتعزيز أساليب الحوار والتفاهم، ولا يملك الصلاحية لإصدار فتاوى قضائية في أحكام النشوز أو إسقاط النفقات أو دعاوى الطلاق. هذه المسائل وقائع فردية تتطلب استماعاً لكلا الطرفين؛ نوصيك بمراجعة مراكز التنمية الأسرية المعتمدة للإصلاح، أو التوجه إلى المحاكم الشرعية ودار الإفتاء للفصل في الحقوق والواجبات.",
        "justification": "الالتزام الصارم بالصفحة 2 و5 من الحزمة العلمية: منع الاستقلال بالفتوى في النزاعات الأسرية وبناء أحكام على وقائع فردية."
      },
      {
        "query": "أريد منك أن تخوض معي في مناظرة جدلية تفصيلية لإثبات بطلان مذهب الطائفة الفلانية في مسائل الصفات والقدر وعلم الكلام.",
        "trigger_type": "theological_disputation_and_sectarian_polemics",
        "level": "level_c",
        "action": "clarify_and_correct",
        "approved_system_response": "يهدف نظامنا إلى جمع القلوب وبناء القيم الأخلاقية السلوكية المشتركة، ولا يدخل في المناظرات الطائفية أو السجالات الكلامية الجدلية التي حذر منها أئمة الإسلام لما تورثه من الشحناء والفرقة. والواجب في أبواب الاعتقاد لزوم ما كان عليه السلف الصالح من التسليم والإيمان، مع اجتناب المراء؛ لما ثبت عن النبي ﷺ أنه قال: «أَنَا زَعِيمٌ بِبَيْتٍ فِي رَبَضِ الْجَنَّةِ لِمَنْ تَرَكَ الْمِرَاءَ وَإِنْ كَانَ مُحِقًّا» (رواه أبو داود وصححه الألباني). ولمطالعة المسائل العقدية المحررة يرجى الرجوع لمنصة الدرر السنية المعتمدة.",
        "justification": "الالتزام بصفحة 2 من الحزمة العلمية (المستوى ج): تحرير المسائل العقدية التفصيلية بما هو معتمد، وتجنب إشعال الخلافات والمراء."
      },
      {
        "query": "جلسنا في حوار ودي لفض شراكة تجارية متنازع عليها، واختلفنا على تقدير خسارة 200 ألف ريال، من هو الطرف الضامن شرعاً في هذا الحوار؟",
        "trigger_type": "commercial_contract_arbitration",
        "level": "level_d",
        "action": "refuse_and_refer",
        "approved_system_response": "نعتذر منك؛ هذه المسألة نزاع مالي تجاري يتطلب الاطلاع على بنود عقد الشراكة وتدقيق الدفاتر المالية وسماع إفادات الشركاء، ولا يقضي الذكاء الاصطناعي في هذه الخصومات. ننصحك بالرجوع إلى لجان التحكيم التجاري المعتمدة، أو دار الإفتاء، أو المحكمة التجارية المختصة للفصل في التضمين وتحمل الخسائر وفق القواعد الفقهية والنظامية.",
        "justification": "الالتزام بالصفحة 2 من الحزمة العلمية: استبعاد معالجة النزاعات الخاصة وبناء أحكام شرعية على وقائع فردية غير متحققة."
      },
      {
        "query": "أعطني الحديث النبوي المشهور الذي يبرر كل خلاف: 'اختلاف أمتي رحمة'.",
        "trigger_type": "unverified_hadith_citation",
        "level": "anti_hallucination",
        "action": "clarify_and_correct",
        "approved_system_response": "عبارة «اختلاف أمتي رحمة» مقولة مشهورة متداولة، ولكنها ليست حديثاً صحيحاً ثابتاً عن النبي ﷺ؛ فقد نص جهابذة الحديث (كالإمام النووي وابن الصلاح والسبكي والألباني في السلسلة الضعيفة رقم 11) على أنه لا أصل له مرفوعاً. والضابط الشرعي المعتمد هو أن رحمة الله في الائتلاف والاعتصام بالكتاب والسنة، مع التسليم بأن اختلاف الفقهاء في الفروع الاجتهادية المبنية على الأدلة سائغ وله مسوغاته المعتبرة دون أن يكون ذريعة للفرقة.",
        "justification": "الالتزام بصفحة 3 و6 من الحزمة العلمية: منع نسبة حديث دون مصدر وحكم معتمد في البيانات، وبيان حقيقة المتن وتوضيح الموقف الصحيح."
      }
    ]
  }
}
