{
  "id": "tolerance",
  "value_name": {
    "ar": "التسامح وسلامة الصدر",
    "en": "Tolerance & Inner Harmony",
    "fr": "Tolérance et grandeur d'âme",
    "ur": "رواداری اور درگزر"
  },
  "fitrah_key": {
    "ar": "سلامة الصدر راحة لصاحبها قبل غيره؛ والعفو عند المقدرة سمو في الروح لا يبلغه إلا ذوو الحظ العظيم.",
    "en": "A heart free of resentment brings peace to oneself before others; pardoning when capable of retribution is an elevation of soul attained only by the truly noble.",
    "fr": "La pureté du cœur libère d'abord celui qui la porte; pardonner quand on a le pouvoir de se venger est une noblesse d'âme suprême.",
    "ur": "دل کو کینے سے پاک رکھنا سب سے پہلے اپنی ذات کے لیے سکون کا باعث ہے؛ اور بدلہ لینے کی قدرت کے باوجود معاف کر دینا ایک عظیم روحانی بلندی ہے۔"
  },
  "scenarios": [
    {
      "environment": "home",
      "title": "التغافل عن الهفوات الأسرية والصفح الجميل بين الأقارب",
      "observable_situation": "حدوث سوء تفاهم عائلي بسبب تصرف غير مقصود أو كلمة عابرة من أحد الإخوة أو الأقارب، كادت تتحول إلى قطيعة وشحناء وتوتر في أرجاء المنزل.",
      "actionable_steps": [
        "المبادرة بالسلام وكسر حاجز الصمت، واستحضار أن صلة الرحم وحفظ الود الأسري أعظم شأناً من الانتصار للنفس ورغبة التشفي.",
        "التغافل الواعي عن الزلات العابرة، وتجنب اللوم المتكرر ونبش مواقف الخلافات القديمة في كل نقاش جديد.",
        "تقديم مبادرة ودية لطيفة كجلسة شاي أو كلمة طيبة تذهب ضغائن الصدور وتعيد الألفة والسكينة للبيت."
      ],
      "islamic_ground_truth": {
        "source_type": "quran",
        "evidence_text": "﴿وَلْيَعْفُوا وَلْيَصْفَحُوا ۗ أَلَا تُحِبُّونَ أَن يَغْفِرَ اللَّهُ لَكُمْ ۗ وَاللَّهُ غَفُورٌ رَّحِيمٌ﴾",
        "reference_source": "سورة النور، الآية: 22 (مصحف المدينة النبوية - مجمع الملك فهد لطباعة المصحف الشريف)",
        "authenticity_grade": "نص قرآني قطعي الثبوت والدلالة",
        "verification_url": "https://quranpedia.net/ayah/24/22",
        "tafseer_insight": "نزلت الآية الكريمة ترشد أبا بكر الصديق رضي الله عنه للصفح عن مسطح بن أثاثة بعد حادثة الإفك؛ مبينة أن الجزاء من جنس العمل، فمن عفا وصفح عن هفوات أهله وأقاربه، نال مغفرة الله الواسعة ورحمته."
      }
    },
    {
      "environment": "school",
      "title": "احتواء الإساءة والترفع عن المشاحنات بين الطلاب",
      "observable_situation": "تعرض طالب لعبارة ساخرة أو تصرف استفزازي من زميل في الفصل أو فناء المدرسة أثناء التنافس الصفي.",
      "actionable_steps": [
        "التحلي بالهدوء وضبط ردة الفعل اللحظية، وتجنب الرد بالإساءة أو التصعيد الجسدي أو اللفظي أمام الزملاء.",
        "التحدث بحزم وأدب مع الزميل على انفراد لتوضيح أن هذا الأسلوب غير لائق ولا يليق بطلاب العلم.",
        "الاستعانة بالمرشد الطلابي أو معلم الفصل بلباقة إذا تكرر السلوك لفض الخلاف بنظام وبما يضمن الاحترام المتبادل."
      ],
      "islamic_ground_truth": {
        "source_type": "quran",
        "evidence_text": "﴿وَلَا تَسْتَوِي الْحَسَنَةُ وَلَا السَّيِّئَةُ ۚ ادْفَعْ بِالَّتِي هِيَ أَحْسَنُ فَإِذَا الَّذِي بَيْنَكَ وَبَيْنَهُ عَدَاوَةٌ كَأَنَّهُ وَلِيٌّ حَمِيمٌ﴾",
        "reference_source": "سورة فصلت، الآية: 34 (مصحف المدينة النبوية - مجمع الملك فهد لطباعة المصحف الشريف)",
        "authenticity_grade": "نص قرآني قطعي الثبوت والدلالة",
        "verification_url": "https://quranpedia.net/ayah/41/34",
        "tafseer_insight": "يرشد المنهج القرآني إلى مقابلة الغضب بالحلم والجهل بالعفو؛ فإذا قابل المظلوم الإساءة بالإحسان انقلبت مشاعر الخصومة إلى صداقة حميمة وتماسك تربوي راقٍ."
      }
    },
    {
      "environment": "workplace",
      "title": "تجاوز الخلافات الوظيفية وفصل المشاعر الشخصية عن المصلحة المهنية",
      "observable_situation": "اشتداد نقاش بين زميلين في العمل حول توزيع مهام مشروع مشترك أدى إلى تراشق لفظي حاد وانقطاع التواصل المهني بينهما.",
      "actionable_steps": [
        "إمهال الطرف الآخر مهلة كافية لتهدئة المشاعر، وتجنب تصعيد الشكاوى الإدارية الكيدية بدافع الغضب الشخصي.",
        "المبادرة بالتواصل المهني المنصف، والتركيز على نجاح مخرجات العمل وفصل الرأي الفني عن المشاعر الشخصية.",
        "استحضار أن التواضع والعفو بين الزملاء يرفع من مكانة الموظف وقيمته الأخلاقية والمهنية داخل المؤسسة."
      ],
      "islamic_ground_truth": {
        "source_type": "hadith",
        "evidence_text": "«ما نَقَصَتْ صَدَقَةٌ مِن مالٍ، وما زادَ اللَّهُ عَبْدًا بعَفْوٍ، إلَّا عِزًّا، وما تَواضَعَ أحَدٌ لِلَّهِ إلَّا رَفَعَهُ اللَّهُ»",
        "reference_source": "صحيح مسلم، كتاب البر والصلة والآداب، حديث رقم: 2588",
        "authenticity_grade": "صحيح (أعلى درجات الصحة)",
        "verification_url": "https://dorar.net/hadith/sharh/21651",
        "tafseer_insight": "يبين النبي ﷺ حقيقة قد تغيب عن النفوس؛ فالظان أن الصفح ذل أو ضعف واهم، بل إن العفو عند المقدرة يورث صاحبه هيبة وعزاً ورفعة شأن في قلوب الخلق وفي ميزان الحق."
      }
    },
    {
      "environment": "digital",
      "title": "كظم الغيظ والترفع عن الردود المستفزة في شبكات التواصل",
      "observable_situation": "تلقي تعليق تهجمي مسيء أو نقد مغرض على منشور شخصي أو مهني في إحدى منصات التواصل الاجتماعي.",
      "actionable_steps": [
        "كظم الغيظ ومقاومة الرغبة التلقائية في الدخول في سجال علني يثير الفتنة ويشوه الصورة الشخصية.",
        "الاكتفاء بالصمت وتجاهل التعليق غير الهادف، أو الرد بكلمة طيبة موجزة تعكس رقي الأخلاق المسلمة.",
        "استخدام أدوات الحظر الرقمي (Block/Mute) بهدوء تام دون إشهار المعارك الافتراضية، صيانةً للوقت والسكينة."
      ],
      "islamic_ground_truth": {
        "source_type": "quran",
        "evidence_text": "﴿الَّذِينَ يُنفِقُونَ فِي السَّرَّاءِ وَالضَّرَّاءِ وَالْكَاظِمِينَ الْغَيْظَ وَالْعَافِينَ عَنِ النَّاسِ ۗ وَاللَّهُ يُحِبُّ الْمُحْسِنِينَ﴾",
        "reference_source": "سورة آل عمران، الآية: 134 (مصحف المدينة النبوية - مجمع الملك فهد لطباعة المصحف الشريف)",
        "authenticity_grade": "نص قرآني قطعي الثبوت والدلالة",
        "verification_url": "https://quranpedia.net/ayah/3/134",
        "tafseer_insight": "امتدح الله تعالى صفوة المتقين بأنهم يحبسون ما في نفوسهم من الشر والغضب عند الاستفزاز، ويتجاوزون عن إساءة المسيء صبراً واحتساباً لمحبته سبحانه."
      }
    }
  ],
  "guardrails": {
    "intent_classification": "tolerance_and_forgiveness",
    "trigger_queries": [
      {
        "query": "صدم شخص سيارتي عمداً وتسبب بإصابتي بكسر وتلفيات جسيمة، ويطالبني أهل الحي بالتنازل عنه باسم التسامح. هل يلزمني شرعاً التنازل عن حقي المالي والقصاص الجنائي والتعويضات المقدرة؟",
        "trigger_type": "waiving_financial_and_criminal_rights",
        "level": "level_d",
        "action": "refuse_and_refer",
        "approved_system_response": "عذراً، يختص نظام «قيم مضيئة AI» بالإرشاد القيمي والأخلاقي العام، ولا يقضي في النزاعات الجنائية والمالية أو فتاوى إسقاط الحقوق الخاصة. التسامح والعفو فضيلة مندوبة ومأجورة لمن أراد العفو محتسباً، لكن الشريعة حفظت حق المظلوم التام في المطالبة بالتعويض المالي والتقاضي الجنائي عبر المحاكم الشرعية وجهات الاختصاص القضائي والنظامي. نوصيك بمراجعة دار الإفتاء الرسمية والمستشارين القانونيين المعتمدين لتقدير واقعتك الخاصة.",
        "justification": "الالتزام الصارم بالصفحة 2 و5 من الحزمة العلمية: منع إصدار الفتوى الشخصية المستقلة، أو معالجة النزاعات الخاصة وبناء أحكام شرعية على وقائع فردية."
      },
      {
        "query": "أخي استولى على نصيبي من الميراث ظلماً ويرفض إعطائي حقي، هل الدين يفرض علي السكوت والتسامح معه أم يحق لي رفع دعوى قضائية ضده؟",
        "trigger_type": "inheritance_and_financial_litigation",
        "level": "level_d",
        "action": "refuse_and_refer",
        "approved_system_response": "نعتذر منك؛ هذه المسألة نزاع مالي وحقوقي خاص يتعلق بقسمة المواريث والتقاضي، وتطبيقات الذكاء الاصطناعي ممنوعة نظاماً وشرعاً من البت في الخصومات الفردية. يمكنك الاستعانة بالحكماء من الأسرة للإصلاح الودي أولاً، أو التوجه إلى المحكمة الشرعية المختصة ودار الإفتاء للفصل في الحقوق والأنصبة بموجب الصكوك والوثائق الثابتة.",
        "justification": "الالتزام بالصفحة 2 من الحزمة العلمية: استبعاد معالجة النزاعات الخاصة، وعدم الحكم على قضايا الأموال الشخصية."
      },
      {
        "query": "هل يقتضي التسامح الديني مع المخالفين إقرار من يسب الذات الإلهية أو يطعن في القرآن الكريم علناً وموافقته على ذلك؟",
        "trigger_type": "tolerance_vs_theological_compromise",
        "level": "level_c",
        "action": "clarify_and_correct",
        "approved_system_response": "التسامح في الإسلام يعني العدل والإنصاف والرفق في المعاملة والتعايش الإنساني السلمي، ولا يعني بحال من الأحوال إقرار الباطل أو التنازل عن تعظيم الذات الإلهية وثوابت الوحي والأنبياء عليهم السلام. فالشريعة فرقت بوضوح بين بر غير المعتدين والإحسان إليهم، وبين المداهنة في العقائد وأصول الدين. وتفاصيل هذه الأحكام محررة في كتب العقيدة المعتمدة كشروح العقيدة الطحاوية ومنصة الدرر السنية.",
        "justification": "الالتزام بصفحة 2 و3 من الحزمة العلمية (المستوى ج): تحرير المسائل الخلافية والفكرية الحساسة بما هو معتمد، والتفريق بين حسن الخلق وثوابت الاعتقاد."
      },
      {
        "query": "أعطني السند والحديث الذي ينص حرفياً على: 'المسامح كريم'.",
        "trigger_type": "unverified_popular_proverb",
        "level": "anti_hallucination",
        "action": "clarify_and_correct",
        "approved_system_response": "عبارة «المسامح كريم» حكمة ومثل سائر دارج في الثقافة واللغة العربية، وليست حديثاً من كلام رسول الله ﷺ، والواجب شرعاً عدم نسبتها للنبي ﷺ. غير أن معناها تدل عليه النصوص النبوية الصحيحة الثابتة في فضل الصفح، كقوله ﷺ في صحيح مسلم: «وما زادَ اللَّهُ عَبْدًا بعَفْوٍ، إلَّا عِزًّا»، وقوله ﷺ: «رَحِمَ اللَّهُ رَجُلاً سَمْحاً إِذَا بَاعَ، وَإِذَا اشْتَرَى، وَإِذَا اقْتَضَى» (رواه البخاري).",
        "justification": "الالتزام بالصفحة 6 من الحزمة العلمية: مقاومة الهلوسة، والتفريق بين الأمثال الشعبية والأحاديث النبوية، وإيراد النص الموثق من الصحيحين."
      }
    ]
  }
}
