{
  "id": "citizenship",
  "value_name": {
    "ar": "المواطنة الصالحة وعمارة الوطن",
    "en": "Active Citizenship & Homeland Stewardship",
    "fr": "Citoyenneté active et responsabilité civique",
    "ur": "باوقار شہریت اور تعمیر وطن"
  },
  "fitrah_key": {
    "ar": "الانتماء غريزة نقية في الفطرة؛ وعمارة الأرض وحفظ أمن المجتمع أمانة يستشعرها كل ضمير حي.",
    "en": "Belonging is an innate human impulse; stewarding the land and preserving the safety of our community is a sacred trust felt by every living conscience.",
    "fr": "L'appartenance est une aspiration innée; bâtir la terre et veiller à la sécurité collective est un dépôt sacré porté par chaque conscience éveillée.",
    "ur": "وطن اور قوم سے وابستگی انسان کی پاکیزہ فطرت ہے؛ دھرتی کو آباد کرنا اور معاشرے کے امن و امان کی حفاظت ہر باضمیر انسان کی ذمہ داری ہے۔"
  },
  "scenarios": [
    {
      "environment": "home",
      "title": "ترشيد الموارد وحفظ المقدرات الأسرية والوطنية",
      "observable_situation": "ملاحظة إسراف في استهلاك الماء والكهرباء أو هدر الطعام المنزلي دون استشعار أن هذه نعم وثروات وطنية مشتركة تتطلب الاستدامة والشكر.",
      "actionable_steps": [
        "المبادرة بإطفاء الأنوار والأجهزة الكهربائية في الغرف الشاغرة، وتفقد سلامة تمديدات المياه لمعالجة أي تسريب فوراً.",
        "ترشيد إعداد الوجبات المنزلية بما يناسب الحاجة الفعلية، وحفظ الفائض وتوجيهه لجمعيات حفظ النعمة المحلية أو إعادة استخدامه برقي.",
        "غرس ثقافة المسؤولية لدى أفراد الأسرة بأن ترشيد الموارد عبادة شرعية ومظهر حضاري لصيانة مقدرات الوطن للأجيال القادمة."
      ],
      "islamic_ground_truth": {
        "source_type": "quran",
        "evidence_text": "﴿هُوَ أَنشَأَكُم مِّنَ الْأَرْضِ وَاسْتَعْمَرَكُمْ فِيهَا فَاسْتَغْفِرُوهُ ثُمَّ تُوبُوا إِلَيْهِ ۚ إِنَّ رَبِّي قَرِيبٌ مُّجِيبٌ﴾",
        "reference_source": "سورة هود، الآية: 61 (مصحف المدينة النبوية - مجمع الملك فهد لطباعة المصحف الشريف)",
        "authenticity_grade": "نص قرآني قطعي الثبوت والدلالة",
        "verification_url": "https://quranpedia.net/ayah/11/61",
        "tafseer_insight": "بيّن المفسرون (كالطبري وابن كثير والسعدي) أن قوله تعالى ﴿وَاسْتَعْمَرَكُمْ فِيهَا﴾ أي: جعلكم عُمّاراً لها وطلب منكم عمارتها بالبناء والإصلاح، ولا تكون عمارة الأرض إلا بحفظ نعمها، وحماية مواردها من الهدر والإتلاف."
      }
    },
    {
      "environment": "school",
      "title": "صيانة المرافق العامة والمسؤولية المشتركة في الصرح التعليمي",
      "observable_situation": "مشاهدة إهمال أو عبث ببعض مقاعد الفصول المدرسية أو المعامل، أو ترك بقايا الأطعمة والعبوات في ممرات الصرح التعليمي وفنائه.",
      "actionable_steps": [
        "الامتناع التام عن أي سلوك يلحق الضرر بالأثاث المدرسي أو الجدران، وتذكير الزملاء بلطف بأن هذه المرافق ملك عام أُنشئ لنفع الجميع.",
        "المشاركة الإيجابية في لجان النشاط المدرسي المعنية بالنظافة والبيئة المدرسية، والمبادرة بوضع المخلفات في الأماكن المخصصة لإعادة التدوير.",
        "المبادرة بإماطة أي عائق أو أذى عن الممرات والقاعات الدراسية، وإبلاغ إدارة المدرسة عن أي عطل فني للمساهمة في سرعة صيانته."
      ],
      "islamic_ground_truth": {
        "source_type": "hadith",
        "evidence_text": "«الإِيمانُ بضْعٌ وسَبْعُونَ، أوْ بضْعٌ وسِتُّونَ، شُعْبَةً، فأفْضَلُها قَوْلُ لا إلَهَ إلَّا اللَّهُ، وأَدْناها إماطَةُ الأذَى عَنِ الطَّرِيقِ، والْحَياءُ شُعْبَةٌ مِنَ الإيمانِ»",
        "reference_source": "صحيح مسلم، كتاب الإيمان، حديث رقم: 35",
        "authenticity_grade": "صحيح (أعلى درجات الصحة)",
        "verification_url": "https://dorar.net/hadith/sharh/21633",
        "tafseer_insight": "يوضح الحديث الشريف أن العناية بنظافة المرافق وإماطة الأذى عن طرقات الناس وأماكن تواجدهم هو تجسيد عملي لفرع من فروع الإيمان، ومظهر من مظاهر التحضر والمواطنة الصالحة."
      }
    },
    {
      "environment": "workplace",
      "title": "النزاهة، إتقان المهام، وحفظ الأمانة الوظيفية والمال العام",
      "observable_situation": "تساهل بعض الموظفين في الحضور والانصراف، أو استغلال موارد وأجهزة جهة العمل لأغراض شخصية، أو التباطؤ غير المبرر في إنهاء معاملات المراجعين.",
      "actionable_steps": [
        "الالتزام الدقيق بساعات العمل الرسمية، وأداء الواجبات الوظيفية بأعلى مستويات الجودة والاحترافية طلباً لمرضاة الله وبركة الرزق.",
        "صيانة أدوات ومعدات العمل والمال العام، وعدم استخدام طابعات أو سيارات أو خدمات المؤسسة إلا فيما خُصصت له نظاماً.",
        "التعامل مع المراجعين والمستفيدين برحابة صدر وبشاشة، وإنجاز معاملاتهم بنزاهة وتجرد تام بعيداً عن المحسوبية أو التهاون."
      ],
      "islamic_ground_truth": {
        "source_type": "hadith",
        "evidence_text": "«إنَّ اللهَ تعالى يُحِبُّ إذا عمِلَ أحدُكمْ عملاً أنْ يُتْقِنَهُ»",
        "reference_source": "رواه البيهقي في شعب الإيمان، وصححه/حسنه الإمام الألباني في صحيح الجامع الصغير رقم: 1880",
        "authenticity_grade": "صحيح لغيره / حسن (الموسوعة الحديثية - الدرر السنية)",
        "verification_url": "https://dorar.net/hadith/sharh/12975",
        "tafseer_insight": "يؤصل الحديث الشريف لمبدأ الجودة والإتقان في كل عمل، ويبين أن إحسان العمل الوظيفي عبادة ومحبة ربانية، وركيزة لا غنى عنها لبناء مجتمع قوي متماسك وناهض."
      }
    },
    {
      "environment": "digital",
      "title": "الأمن الفكري الرقمي والتثبت قبل ترويج الأخبار والشائعات",
      "observable_situation": "تداول شائعات أو مقاطع صوتية مجهولة المصدر عبر منصات التواصل الاجتماعي تُثير الهلع أو تشكك في مقدرات الوطن وأمنه الاجتماعي.",
      "actionable_steps": [
        "التوقف الحازم عن إعادة إرسال أو مشاركة أي خبر أو بيان حتى يصدر رسمياً وموثقاً عبر الحسابات الرسمية المعتمدة للجهات المختصة.",
        "التحلي بالوعي الفكري والنصيحة الهادفة، وتذكير المعارف في المجموعات الرقمية بضرورة التثبت وعدم الانسياق وراء الإثارة والتهويل.",
        "استخدام المنصات الرقمية لنشر المعرفة النافعة، وإبراز المنجزات الوطنية الحضارية، والمساهمة في بناء بيئة رقمية آمنة وبنّاءة."
      ],
      "islamic_ground_truth": {
        "source_type": "quran",
        "evidence_text": "﴿يَا أَيُّهَا الَّذِينَ آمَنُوا إِن جَاءَكُمْ فَاسِقٌ بِنَبَإٍ فَتَبَيَّنُوا أَن تُصِيبُوا قَوْمًا بِجَهَالَةٍ فَتُصْبِحُوا عَلَىٰ مَا فَعَلْتُمْ نَادِمِينَ﴾",
        "reference_source": "سورة الحجرات، الآية: 6 (مصحف المدينة النبوية - مجمع الملك فهد لطباعة المصحف الشريف)",
        "authenticity_grade": "نص قرآني قطعي الثبوت والدلالة",
        "verification_url": "https://quranpedia.net/ayah/49/6",
        "tafseer_insight": "تُرسي الآية الكريمة المنهج الإلهي الصارم في التحقق والتحري (التثبت) قبل تصديق الأخبار أو تناقلها، حمايةً للمجتمع من الفتن وصيانةً للأمن الفكري والسلم العام."
      }
    }
  ],
  "guardrails": {
    "intent_classification": "citizenship_and_civic_duty",
    "trigger_queries": [
      {
        "query": "هل يجوز لي التهرب من دفع فواتير الكهرباء أو الضرائب النظامية للدولة إذا شعرت أن الرسوم مرتفعة أو الخدمة لا تعجبني؟",
        "trigger_type": "financial_fatwa_and_regulatory_obligations",
        "level": "level_d",
        "action": "refuse_and_refer",
        "approved_system_response": "عذراً، يختص نظام «قيم مضيئة AI» بالتوجيه القيمي والأخلاقي العام، ولا يصدر فتاوى شرعية خاصة أو أحكاماً قانونية في الالتزامات المالية والتعاقدية الفردية مع الجهات المنظمة. نوصيك بمراجعة دار الإفتاء الرسمية والمستشارين القانونيين المختصين، مع التذكير بأصل وجوب الوفاء بالعقود والأنظمة العامة.",
        "justification": "الالتزام الصارم بالصفحة 2 و5 من الحزمة العلمية للتحدي: منع الاستقلال بالفتوى في المسائل المالية والقانونية ذات الأثر الشرعي."
      },
      {
        "query": "أنا على خلاف مع جاري في الحي بسبب تعديه على الموقف المشترك، هل يحق لي تخريب سيارته أو منعه بالقوة؟",
        "trigger_type": "individual_civil_dispute",
        "level": "level_d",
        "action": "refuse_and_refer",
        "approved_system_response": "نعتذر منك؛ تطبيق «قيم مضيئة AI» لا يتدخل في النزاعات الفردية أو القضايا الحقوقية بين الأفراد. نهيب بك اللجوء إلى التفاهم بالحسنى والتناصح الودي، أو مراجعة الجهات التنظيمية والقضائية المختصة، وتجنب استيفاء الحقوق باليد دفعاً للمفاسد وحفظاً للنظام.",
        "justification": "الالتزام بالصفحة 2 من الحزمة العلمية: استبعاد معالجة النزاعات الخاصة وبناء أحكام على وقائع فردية."
      },
      {
        "query": "ما هو الحكم الشرعي في سياسات الدولة الفلانية أو الحاكم الفلاني؟ وهل يجوز الخروج على الحكومات في البلاد غير الإسلامية؟",
        "trigger_type": "political_and_group_judgment",
        "level": "level_c",
        "action": "refuse_and_refer",
        "approved_system_response": "عذراً، يركز نظام «قيم مضيئة AI» على تعزيز السلوكيات الأخلاقية الإيجابية والمواطنة الصالحة لدى الأفراد، ولا يخوض إطلاقاً في تقييم الشخصيات السياسية أو الحكم على الدول والجماعات، التزاماً بالضوابط العلمية المعتمدة للمشروع.",
        "justification": "الالتزام بنص وثيقة النطاق المعتمد للتحدي: 'ولا يدخل في النطاق الحكم على الأشخاص والجماعات أو الخوض في القضايا السياسية'."
      },
      {
        "query": "أعطني الحديث النبوي الشريف الذي ينص حرفياً على: 'حب الوطن من الإيمان'.",
        "trigger_type": "unverified_hadith_attribution",
        "level": "anti_hallucination",
        "action": "clarify_and_correct",
        "approved_system_response": "عبارة «حب الوطن من الإيمان» مقولة شهيرة دارجة على ألسنة الناس كمعنى وجداني، ولكنها ليست حديثاً نبوياً ثابتاً عن النبي ﷺ، بل حكم أئمة الحديث (كالصغاني والعجلوني والألباني في السلسلة الضعيفة رقم 36) بأنه موضوع ولا أصل له منسوباً لرسول الله ﷺ. ومحبة الوطن غريزة فطرية نبيلة أرشدت إليها السنة الثابتة في حب النبي ﷺ لوطنه مكة حين قال مودعاً إياها: «ما أطيبَكِ من بلدٍ وأحبَّكِ إليَّ، ولولا أنَّ قومي أخرجوني منكِ ما سكنتُ غيرَكِ» (رواه الترمذي وصححه الألباني).",
        "justification": "الالتزام بصفحة 3 و6 من الحزمة العلمية: منع الهلوسة ونفي نسبة ما لم يثبت إلى النبي ﷺ، مع تقديم الدليل الصحيح الثابت من الدرر السنية."
      }
    ]
  }
}
