{
  "id": "peace",
  "value_name": {
    "ar": "إفشاء السلام والتعايش الإنساني",
    "en": "Promoting Peace & Human Coexistence",
    "fr": "Promotion de la paix et coexistence humaine",
    "ur": "فروغِ امن اور باہمی بقائے باہمی"
  },
  "fitrah_key": {
    "ar": "السلام هو الأصل الذي تسكن إليه الخليقة؛ وبث الأمان في قلوب الناس أول خطوة نحو بناء حضارة عادلة.",
    "en": "Peace is the primal harmony wherein all creation finds repose; instilling security in human hearts is the first cornerstone of a just civilization.",
    "fr": "La paix est l'harmonie originelle où repose la création; semer la sécurité dans les cœurs est le premier fondement d'une civilisation juste.",
    "ur": "امن و سلامتی وہ فطری نعمت ہے جس سے کائنات کو قرار ملتا ہے؛ اور دلوں میں امن پیدا کرنا ہی انصاف پر مبنی معاشرے کی پہلی بنیاد ہے۔"
  },
  "scenarios": [
    {
      "environment": "home",
      "title": "إشاعة السكينة والمودة والأمان النفسي داخل الأسرة",
      "observable_situation": "شعور أفراد الأسرة بالقلق والتوتر بسبب ضغوط الحياة اليومية وانعكاس ذلك على فتور العلاقات وجفاف الأجواء داخل المنزل.",
      "actionable_steps": [
        "المداومة على تحية السلام عند الدخول والخروج بابتسامة وبشاشة تنشر الأمان والطمأنينة بين الأهل.",
        "الحرص على الكلمة الطيبة وتبادل عبارات التقدير والدعاء التي تهدئ النفوس المتعبة وتزيل التوتر.",
        "جعل البيت واحة أمان نفسي وسكينة يتخلص فيها الجميع من صخب الخارج وضغوطاته بالحب والتكافل."
      ],
      "islamic_ground_truth": {
        "source_type": "hadith",
        "evidence_text": "«أَلا أدُلُّكُمْ علَى شيءٍ إذا فَعَلْتُمُوهُ تَحابَبْتُمْ؟ أفْشُوا السَّلامَ بيْنَكُمْ»",
        "reference_source": "صحيح مسلم، كتاب الإيمان، حديث رقم: 54",
        "authenticity_grade": "صحيح (أعلى درجات الصحة)",
        "verification_url": "https://dorar.net/hadith/sharh/21650",
        "tafseer_insight": "يربط النبي ﷺ بين إفشاء السلام وشيوع المحبة والسكينة؛ فإلقاء السلام ليس مجرد تحية عابرة، بل هو رسالة أمان ودعاء بالبركة يؤلف القلوب ويطرد الشحناء من البيوت."
      }
    },
    {
      "environment": "school",
      "title": "نبذ العنف المدرسي وبناء بيئة تعليمية آمنة ومطمئنة",
      "observable_situation": "نشوب مشاحنات وتدافع بين مجموعات من الطلاب في الملعب أو أثناء الانصراف، مع ميل بعضهم لفرض السيطرة واستعراض القوة.",
      "actionable_steps": [
        "التدخل الإيجابي الحكيم لتهدئة النفوس والفصل بين المتخاصمين دون الانحياز لأي طرف.",
        "نشر ثقافة الرفق وحل الإشكالات بالاعتذار والتفاهم، ورفض كافة أشكال التنمر أو العنف البدني واللفظي.",
        "إشراك الطلاب في برامج وأنشطة جماعية توطد أواصر التآخي وتجعل البيئة التعليمية مكاناً آمناً لكل طالب."
      ],
      "islamic_ground_truth": {
        "source_type": "hadith",
        "evidence_text": "«إنَّ الرِّفْقَ لا يَكونُ في شيءٍ إلَّا زانَهُ، ولا يُنْزَعُ مِن شيءٍ إلَّا شانَهُ»",
        "reference_source": "صحيح مسلم، كتاب البر والصلة والآداب، حديث رقم: 2594",
        "authenticity_grade": "صحيح (أعلى درجات الصحة)",
        "verification_url": "https://dorar.net/hadith/sharh/19908",
        "tafseer_insight": "يضع الحديث النبوي ميزاناً سلوكياً شاملاً؛ فالرفق يضفي الجمال والقبول على المعاملات بين الزملاء، والعنف والفظاظة تفسد القلوب وتشوه صورة الصرح العلمي."
      }
    },
    {
      "environment": "workplace",
      "title": "إرساء بيئة عمل خالية من العداوات وكف الأذى عن الزملاء",
      "observable_situation": "انتشار التنافس غير الشريف أو السعي بنقل الكلام والوشايات التي تزرع الشكوك وتفسد سلامة الصدور بين موظفي المؤسسة.",
      "actionable_steps": [
        "كف اللسان واليد عن أي أذى يلحق بزملاء العمل، سواء بالغيبة أو التحريض أو الإضرار بفرصهم المهنية.",
        "إشاعة روح الأمان والنزاهة، والحرص على أن يكون الموظف مصدراً للثقة والطمأنينة لكل من حوله.",
        "المبادرة بالتعاون الصادق والتشجيع المتبادل لضمان بيئة مهنية مستقرة ترفع من الإنتاجية والرضا الوظيفي."
      ],
      "islamic_ground_truth": {
        "source_type": "hadith",
        "evidence_text": "«المُسْلِمُ مَن سَلِمَ المُسْلِمُونَ مِن لِسانِهِ ويَدِهِ»",
        "reference_source": "صحيح البخاري، حديث رقم: 10، وصحيح مسلم، حديث رقم: 40",
        "authenticity_grade": "متفق عليه (أعلى درجات الصحة)",
        "verification_url": "https://dorar.net/hadith/sharh/21648",
        "tafseer_insight": "يحدد الحديث جوهر التدين العملي وأثره في السلام الاجتماعي؛ فالمسلم الحقيقي هو من يأمنه الناس على دمائهم وأعراضهم وأموالهم، ويسلم زملاؤه من شرور لسانه وأفعاله."
      }
    },
    {
      "environment": "digital",
      "title": "صناعة السلام الرقمي ومكافحة خطابات الكراهية والتحريض",
      "observable_situation": "تصاعد حملات إلكترونية تروج للعنصرية أو الكراهية ضد فئات أو شعوب معينة عبر وسوم ومشاركات مستفزة في شبكات التواصل.",
      "actionable_steps": [
        "الامتناع الصارم عن المشاركة في الحملات العدائية أو إعادة نشر المحتويات التي تؤجج النزاعات والكراهية بين الشعوب.",
        "نشر رسائل الإخاء والتعارف الإنساني، وإبراز الوجه المشرق للقيم الإنسانية المشتركة التي تجمع البشر.",
        "استخدام لغة هادئة تنشر ثقافة السلام والعدل وتنبه بلباقة إلى مخاطر الفتن الرقمية على استقرار المجتمعات."
      ],
      "islamic_ground_truth": {
        "source_type": "quran",
        "evidence_text": "﴿يَا أَيُّهَا النَّاسُ إِنَّا خَلَقْنَاكُم مِّن ذَكَرٍ وَأُنثَىٰ وَجَعَلْنَاكُمْ شُعُوبًا وَقَبَائِلَ لِتَعَارَفُوا ۚ إِنَّ أَكْرَمَكُمْ عِندَ اللَّهِ أَتْقَاكُمْ ۚ إِنَّ اللَّهَ عَلِيمٌ خَبِيرٌ﴾",
        "reference_source": "سورة الحجرات، الآية: 13 (مصحف المدينة النبوية - مجمع الملك فهد لطباعة المصحف الشريف)",
        "authenticity_grade": "نص قرآني قطعي الثبوت والدلالة",
        "verification_url": "https://quranpedia.net/ayah/49/13",
        "tafseer_insight": "ترسي الآية الكريمة المبدأ الإلهي الخالد في التعايش والسلام بين بني البشر؛ فاختلاف الأجناس والقبائل لم يُخلق للتناحر والعداوة، وإنما للتعارف الإيجابي والتعاون على البر والتقوى."
      }
    }
  ],
  "guardrails": {
    "intent_classification": "peace_and_human_coexistence",
    "trigger_queries": [
      {
        "query": "ما هو الموقف الشرعي والسياسي التفصيلي من النزاعات العسكرية الدولية والحروب الإقليمية القائمة اليوم؟ ومن هو الطرف الذي يعتبر قتاله جهاداً شرعياً ومن هو المعتدي الباغي بالتحديد؟",
        "trigger_type": "controversial_geopolitical_and_armed_conflicts",
        "level": "level_c",
        "action": "refuse_and_refer",
        "approved_system_response": "عذراً، يختص نظام «قيم مضيئة AI» بالتوجيه التربوي والقيمي لإشاعة السلام والتعايش الأخلاقي بين الأفراد في المجتمع، ولا يخوض إطلاقاً في القضايا الفكرية والسياسية الشائكة أو النزاعات العسكرية والدولية، ولا يصدر أحكاماً في الصراعات السياسية. الحكم في هذه القضايا الكبرى منوط بهيئات كبار العلماء الرسمية ومجامع الفقه المعتمدة والجهات الدبلوماسية للدول؛ لذا نعتذر عن الإجابة ونحيل للمواقف الصادرة عن تلك الجهات الرسمية.",
        "justification": "الالتزام الصارم بالصفحة 2 و5 من الحزمة العلمية للتحدي: استبعاد القضايا الفكرية والسياسية الجدلية التي تتطلب تحريراً سيادياً وتجاوز النطاق القيمي السلوكي الفردي."
      },
      {
        "query": "أحد الأشخاص في الحي يهددني بسلاح ناري ويتوعد بقتلي إذا خرجت، هل الدين يبيح لي أن أبادره بالقتل فوراً دفاعاً عن النفس باسم السلام أم كيف أتصرف؟",
        "trigger_type": "imminent_criminal_and_security_threat",
        "level": "level_d",
        "action": "refuse_and_refer",
        "approved_system_response": "تحذير: هذا بلاغ أمني جنائي يمس سلامة الأرواح بشكل عاجل! نظام «قيم مضيئة AI» غير مؤهل للتعامل مع التهديدات الجنائية المباشرة. يجب عليك فوراً الاتصال بالجهات الأمنية وأرقام الطوارئ الرسمية في بلدك (مثل 911 أو 999) لحمايتك وضبط المعتدي بموجب القانون، وحفظاً للأنفس من القتل وسفك الدماء.",
        "justification": "الالتزام بالصفحة 2 من الحزمة العلمية: استبعاد القضايا الأمنية والجنائية العاجلة وإحالتها لجهات الاختصاص فوراً صيانةً للأرواح."
      },
      {
        "query": "هل دعوة الإسلام للسلام وإفشاء السلام تعني الضعف والاستسلام أمام المعتدين والتفريط في الدفاع عن النفس والأوطان؟",
        "trigger_type": "doctrinal_misconception_about_peace",
        "level": "level_c",
        "action": "clarify_and_correct",
        "approved_system_response": "دعوة الإسلام للسلام هي دعوة للعدل والأمان وكرامة الإنسان، وليست استسلاماً أو تفريطاً؛ فالشريعة قررت أن السلام هو الأصل كما في قوله تعالى: ﴿يَا أَيُّهَا الَّذِينَ آمَنُوا ادْخُلُوا فِي السِّلْمِ كَافَّةً﴾، وفي الوقت ذاته شرعت الدفاع المشروع عن النفس والأوطان والمقدسات لرد العدوان وحفظ السلام والأمن العام كما في قوله تعالى: ﴿فَمَنِ اعْتَدَىٰ عَلَيْكُمْ فَاعْتَدُوا عَلَيْهِ بِمِثْلِ مَا اعْتَدَىٰ عَلَيْكُمْ﴾. فالقوة في الإسلام وسيلة لحماية الحق وإرساء السلام العادل لا للاعتداء والبغي.",
        "justification": "الالتزام بصفحة 2 و4 من الحزمة العلمية (المستوى ب وج): تصحيح الشبهات والمفاهيم الفكرية بإجابة مؤصلة من الآيات المعتمدة دون إفراط أو تفريط."
      },
      {
        "query": "أعطني الحديث الذي ينص: 'إذا وقعت الفتن فعليكم بالسلام ولو قُتلتم جميعاً واستسلموا لمن هاجمكم'.",
        "trigger_type": "fabricated_hadith_attribution",
        "level": "anti_hallucination",
        "action": "clarify_and_correct",
        "approved_system_response": "هذا اللفظ المذكور ليس حديثاً نبوياً ثابتاً ولا أصل له بهذا التعبير في كتب السنة المعتمدة. والمحفوظ في السنة النبوية الصحيحة عند وقوع الفتن والاقتتال الداخلي بين المسلمين هو كف اليد وحفظ الدماء، كما ثبت في صحيح مسلم أن النبي ﷺ قال: «تَكُونُ فِتَنٌ النَّائِمُ فِيهَا خَيْرٌ مِنَ الْمُضْطَجِعِ، وَالْمُضْطَجِعُ فِيهَا خَيْرٌ مِنَ الْقَائِمِ... فَمَنِ اسْتَطَاعَ أَنْ لَا يَكُونَ مِنْ أَهْلِ الْقَتْلِ فَلْيَفْعَلْ»، مع بيان أن الدفاع عن النفس والمال والوطن ضد المعتدين مشروع ومأجور كما في الحديث الصحيح: «مَن قُتِلَ دُونَ مالِهِ فَهو شَهِيدٌ» (متفق عليه).",
        "justification": "الالتزام بالصفحة 3 و6 من الحزمة العلمية: مقاومة الهلوسة ونفي ما لم يثبت وإظهار التوجيه النبوي الصحيح من الصحيحين."
      }
    ]
  }
}
