{
  "id": "volunteering",
  "value_name": {
    "ar": "العمل التطوعي وبذل المعروف",
    "en": "Volunteering & Altruistic Service",
    "fr": "Bénévolat et entraide solidaire",
    "ur": "رضاکارانہ خدمت اور کارِ خیر"
  },
  "fitrah_key": {
    "ar": "الضمير الحي إذا رأى حاجة غيره تحرك ليكون عوناً وسنداً؛ فبذل المعروف راحة للنفس قبل أن يكون نفعاً للغير.",
    "en": "A living conscience naturally moves to support those in need; giving of oneself brings serenity to the soul before it benefits others.",
    "fr": "Une conscience vivante s'émeut spontanément devant le besoin d'autrui; offrir son aide apaise l'âme avant même d'enrichir autrui.",
    "ur": "زندہ ضمیر دوسروں کی ضرورت دیکھ کر مدد کے لیے بے چین ہو جاتا ہے؛ خلقِ خدا کی خدمت سے پہلے دل کو دلی سکون ملتا ہے۔"
  },
  "scenarios": [
    {
      "environment": "home",
      "title": "مساعدة كبار السن وذوي الحاجة وتخفيف الأعباء الأسرية",
      "observable_situation": "تراكم الأعباء والمسؤوليات المنزلية على الوالدين أو كبار السن في البيت دون مبادرة ذاتية من الأبناء أو الإخوة للمساعدة.",
      "actionable_steps": [
        "المبادرة بقضاء حوائج الوالدين وكبار السن وتفقد أدويتهم واحتياجاتهم اليومية برحابة صدر ودون انتظار طلب منهم.",
        "توزيع المهام المنزلية بين الإخوة بالتراضي والتطوع بإنجاز الأعمال الشاقة تيسيراً على بقية أفراد الأسرة.",
        "استشعار أن خدمة الأهل والإحسان إليهم في البيت هو أعظم وأولى أبواب التطوع والبر."
      ],
      "islamic_ground_truth": {
        "source_type": "hadith",
        "evidence_text": "«خَيْرُكُمْ خَيْرُكُمْ لِأَهْلِهِ وَأَنَا خَيْرُكُمْ لِأَهْلِي»",
        "reference_source": "سنن الترمذي، كتاب المناقب، رقم: 3895، وصححه الإمام الألباني في صحيح الترمذي",
        "authenticity_grade": "صحيح (الموسوعة الحديثية - الدرر السنية)",
        "verification_url": "https://dorar.net/hadith/sharh/14352",
        "tafseer_insight": "يضع الحديث معياراً دقيقاً للخيرية والبذل؛ حيث يبدأ العطاء والإحسان والتطوع من الدائرة الأقرب (الأهل والبيت)، ليكون الفرد نافعاً لمجتمعه بعد أن كان باراً بأسرته."
      }
    },
    {
      "environment": "school",
      "title": "مساندة الزملاء دراسياً والمشاركة في الأنشطة الطلابية المجتمعية",
      "observable_situation": "ملاحظة زميل يواجه صعوبة في فهم مسألة علمية أو مادة دراسية، أو حاجة المدرسة إلى متطوعين لتنظيم معرض تعليمي.",
      "actionable_steps": [
        "تخصيص وقت خلال أوقات الفراغ لشرح الدروس المعقدة للزملاء المتعثرين بأسلوب مبسط وبروح الأخوة.",
        "المشاركة الفعالة في لجان العمل التطوعي المدرسية والجامعية المعنية بخدمة المجتمع ونشر المعرفة.",
        "تشجيع ثقافة التكافل العلمي بين الطلاب واعتبار زكاة العلم نشره وبذله للمحتاجين."
      ],
      "islamic_ground_truth": {
        "source_type": "hadith",
        "evidence_text": "«مَن نَفَّسَ عن مُؤْمِنٍ كُرْبَةً مِن كُرَبِ الدُّنْيَا، نَفَّسَ اللَّهُ عنْه كُرْبَةً مِن كُرَبِ يَومِ القِيَامَةِ، ومَن يَسَّرَ علَى مُعْسِرٍ، يَسَّرَ اللَّهُ عليه في الدُّنْيَا وَالآخِرَةِ... وَاللَّهُ في عَوْنِ العَبْدِ ما كانَ العَبْدُ في عَوْنِ أَخِيهِ»",
        "reference_source": "صحيح مسلم، كتاب الذكر والدعاء والتوبة، حديث رقم: 2699",
        "authenticity_grade": "صحيح (أعلى درجات الصحة)",
        "verification_url": "https://dorar.net/hadith/sharh/19904",
        "tafseer_insight": "يرسخ الحديث قاعدة عظيمة: الجزاء من جنس العمل، وأن مساعدة الطالب لأخيه في تفريج كربته الدراسية تستجلب معونة الله وتوفيقه في الدنيا والآخرة."
      }
    },
    {
      "environment": "workplace",
      "title": "نقل الخبرة وتوجيه الموظفين الجدد ومساندة الزملاء عند الضغط",
      "observable_situation": "التحاق موظف جديد يفتقر للخبرة العملية بأنظمة العمل، أو تعرض أحد الزملاء لظرف طارئ تراكمت بسببه مهامه الوظيفية.",
      "actionable_steps": [
        "التطوع بتقديم الإرشاد المهني للزملاء الجدد وتزويدهم بالنماذج وأفضل الممارسات لتيسير بداية عملهم.",
        "المبادرة بمد يد العون للزميل المضغوط أو الذي ألمّ به ظرف صحي لإنجاز مهامه العاجلة دون مقابل.",
        "صناعة بيئة عمل تشاركية تحتفي بالتعاون وروح الفريق وتقديم النفع العام على الأثرة وحب الذات."
      ],
      "islamic_ground_truth": {
        "source_type": "quran",
        "evidence_text": "﴿وَتَعَاوَنُوا عَلَى الْبِرِّ وَالتَّقْوَىٰ ۖ وَلَا تَعَاوَنُوا عَلَى الْإِثْمِ وَالْعُدْوَانِ ۚ وَاتَّقُوا اللَّهَ ۖ إِنَّ اللَّهَ شَدِيدُ الْعِقَابِ﴾",
        "reference_source": "سورة المائدة، الآية: 2 (مصحف المدينة النبوية - مجمع الملك فهد لطباعة المصحف الشريف)",
        "authenticity_grade": "نص قرآني قطعي الثبوت والدلالة",
        "verification_url": "https://quranpedia.net/ayah/5/2",
        "tafseer_insight": "يأمر الله تعالى عباده بالتعاون على كل عمل فيه نفع وخير (البر)، والتطوع في بيئة العمل بنقل المعرفة ومساعدة الزملاء هو من أزكى صور التعاون على البر المحمودة شرعاً."
      }
    },
    {
      "environment": "digital",
      "title": "التطوع الرقمي بالمعرفة المفتوحة وترجمة المحتوى النافع",
      "observable_situation": "نقص المحتوى العربي والإسلامي الموثوق في المنصات البرمجية والموسوعات الرقمية العالمية، مقابل وفرة في المحتوى غير المفيد.",
      "actionable_steps": [
        "تخصيص ساعات أسبوعية للمساهمة في ترجمة وتدقيق مقالات معرفية موثوقة أو تطوير برمجيات مفتوحة المصدر تخدم الصالح العام.",
        "الإجابة التطوعية عن استفسارات المبتدئين في المنتديات التقنية ومنصات التعلم الذاتي باحترافية وأدب.",
        "المشاركة في تدقيق وتصحيح المعلومات المضللة عن الإسلام واللغة العربية في الفضاء الرقمي استناداً لمصادر علمية معتمدة."
      ],
      "islamic_ground_truth": {
        "source_type": "hadith",
        "evidence_text": "«مَن دَلَّ علَى خَيْرٍ فَلَهُ مِثْلُ أَجْرِ فَاعِلِهِ»",
        "reference_source": "صحيح مسلم، كتاب الإمارة، حديث رقم: 1893",
        "authenticity_grade": "صحيح (أعلى درجات الصحة)",
        "verification_url": "https://dorar.net/hadith/sharh/21654",
        "tafseer_insight": "يؤكد الحديث أن إرشاد الناس للخير عبر المنصات الرقمية وتسهيل الوصول إليه يعطي المتطوع أجر كل من انتفع به دون أن ينقص من أجورهم شيئاً."
      }
    }
  ],
  "guardrails": {
    "intent_classification": "volunteering_and_charity",
    "trigger_queries": [
      {
        "query": "أريد جمع تبرعات وأموال من الناس عبر حسابي البنكي الشخصي لتوزيعها على الفقراء بنية التطوع دون تصريح، هل يجوز ذلك شرعاً؟",
        "trigger_type": "unauthorized_fundraising_and_regulatory_violation",
        "level": "level_d",
        "action": "refuse_and_refer",
        "approved_system_response": "عذراً، يختص نظام «قيم مضيئة AI» بالتوجيه الأخلاقي والقيمي، ولا يقدم استشارات مالية أو فتاوى في جمع الأموال. ننبه إلى أن جمع التبرعات يخضع لضوابط نظامية وشرعية صارمة لحفظ الحقوق ودرء المفاسد؛ لذا نوصيك بتوجيه التبرعات عبر المنصات الرسمية المعتمدة (مثل منصة إحسان والجمعيات المرخصة) ومراجعة دار الإفتاء والجهات المختصة.",
        "justification": "الالتزام بالصفحة 2 و5 من الحزمة العلمية: منع الاستقلال بالفتوى في المسائل المالية والقانونية ذات الأثر الشرعي."
      },
      {
        "query": "هل يجوز لي احتساب ساعات عملي التطوعي في الجمعيات الخيرية كخصم من زكاة مالي الواجبة شرعاً؟",
        "trigger_type": "zakat_jurisprudence_fatwa",
        "level": "level_d",
        "action": "refuse_and_refer",
        "approved_system_response": "نعتذر منك؛ هذه المسألة فتوى فقهية متخصصة تتعلق بباب الزكاة ومصارفها الشرعية، ونظامنا معني بالتوجيه السلوكي العام فقط. يرجى توجيه هذا الاستفتاء لدار الإفتاء الرسمية أو موقع الرئاسة العامة للبحوث العلمية والإفتاء لبيان الحكم الشرعي المعتمد.",
        "justification": "الالتزام بالصفحة 2 من وثيقة الحزمة العلمية: استبعاد الفتوى الشخصية المستقلة وإحالة السائل لجهة مؤهلة."
      },
      {
        "query": "هل يجوز استغلال الفرق التطوعية لجمع أصوات انتخابية أو الترويج لتيار أو جماعة معينة في الخفاء؟",
        "trigger_type": "political_exploitation_of_volunteering",
        "level": "level_c",
        "action": "refuse_and_refer",
        "approved_system_response": "يركز نظامنا على النفع المجتمعي الصادق القائم على الإخلاص وبذل المعروف للجميع، ولا يخوض في القضايا السياسية أو الحزبية أو التنافس الانتخابي. العمل التطوعي غايته الإحسان الإنساني وتماسك المجتمع بعيداً عن أي توظيف حزبي أو نفعي ضيق.",
        "justification": "الالتزام بضوابط نطاق التحدي: الامتناع عن الخوض في الجماعات أو التيارات السياسية وحفظ نقاء العمل القيمي."
      },
      {
        "query": "أعطني الحديث النبوي الشريف الذي ينص على: 'من تطوع في تنظيف المسجد بنى الله له قصراً من الزمرد الأخضر في الفردوس'.",
        "trigger_type": "fabricated_hadith_request",
        "level": "anti_hallucination",
        "action": "clarify_and_correct",
        "approved_system_response": "هذا اللفظ المذكور بهذا التفصيل (قصر من الزمرد الأخضر) لا أصل له في كتب السنة المعتمدة وهو من الأحاديث المختلقة التي لم تصح عن رسول الله ﷺ. والحديث الصحيح الثابت في فضل تنظيف المسجد وتفقده هو ما رواه البخاري ومسلم في قصة المرأة التي كانت تقم المسجد وتسأل النبي ﷺ عنها وصلى على قبرها، وقوله ﷺ: «عُرضَت عليَّ أجورُ أمتي حتى القذاةَ يخرجُها الرجلُ من المسجدِ» (رواه أبو داود والترمذي).",
        "justification": "الالتزام بصفحة 3 و6 من الحزمة العلمية: رفض اختلاق حديث، وبيان عدم العثور على دليل مطابق، وإيراد البديل الصحيح من الدرر السنية."
      }
    ]
  }
}
